<?xml version="1.0" encoding="UTF-8"?>
<!--~~~~~~~~~~~~~~~~~~~~~~~~~~~~~~~~~~~~~~~~~~~~~~~~~~~~~~~~~~~~~~~~~~~~~~~~~~~
  ~ JBoss, a division of Red Hat                                              ~
  ~ Copyright 2006, Red Hat Middleware, LLC, and individual                   ~
  ~ contributors as indicated by the @authors tag. See the                    ~
  ~ copyright.txt in the distribution for a full listing of                   ~
  ~ individual contributors.                                                  ~
  ~                                                                           ~
  ~ This is free software; you can redistribute it and/or modify it           ~
  ~ under the terms of the GNU Lesser General Public License as               ~
  ~ published by the Free Software Foundation; either version 2.1 of          ~
  ~ the License, or (at your option) any later version.                       ~
  ~                                                                           ~
  ~ This software is distributed in the hope that it will be useful,          ~
  ~ but WITHOUT ANY WARRANTY; without even the implied warranty of            ~
  ~ MERCHANTABILITY or FITNESS FOR A PARTICULAR PURPOSE. See the GNU          ~
  ~ Lesser General Public License for more details.                           ~
  ~                                                                           ~
  ~ You should have received a copy of the GNU Lesser General Public          ~
  ~ License along with this software; if not, write to the Free               ~
  ~ Software Foundation, Inc., 51 Franklin St, Fifth Floor, Boston, MA        ~
  ~ 02110-1301 USA, or see the FSF site: http://www.fsf.org.                  ~
  ~~~~~~~~~~~~~~~~~~~~~~~~~~~~~~~~~~~~~~~~~~~~~~~~~~~~~~~~~~~~~~~~~~~~~~~~~~~-->

<!DOCTYPE deployments PUBLIC
   "-//JBoss Portal//DTD Portal Object 2.6//EN"
   "http://www.jboss.org/portal/dtd/portal-object_2_6.dtd">
   
<deployments>
   <deployment>
      <parent-ref>admin</parent-ref>
      <page>
         <page-name>CMS</page-name>
         <supported-locale>en</supported-locale>
         <supported-locale>zh</supported-locale>
         <supported-locale>ja</supported-locale>
         <resource-bundle>Resource</resource-bundle>
         <window>
            <window-name>CMSAdminPortletWindow</window-name>
            <instance-ref>CMSAdminPortletInstance</instance-ref>
            <region>center</region>
            <height>0</height>
            <properties>
               <property>
                  <name>theme.renderSetId</name>
                  <value>emptyRenderer</value>
               </property>
            </properties>
         </window>
         <properties>
            <property>
               <name>layout.id</name>
               <value>1column</value>
            </property>
         </properties>
      </page>
   </deployment>
</deployments>
