<?xml version="1.0" encoding="UTF-8"?>
<!--~~~~~~~~~~~~~~~~~~~~~~~~~~~~~~~~~~~~~~~~~~~~~~~~~~~~~~~~~~~~~~~~~~~~~~~~~~~
  ~ JBoss, a division of Red Hat                                              ~
  ~ Copyright 2006, Red Hat Middleware, LLC, and individual                   ~
  ~ contributors as indicated by the @authors tag. See the                    ~
  ~ copyright.txt in the distribution for a full listing of                   ~
  ~ individual contributors.                                                  ~
  ~                                                                           ~
  ~ This is free software; you can redistribute it and/or modify it           ~
  ~ under the terms of the GNU Lesser General Public License as               ~
  ~ published by the Free Software Foundation; either version 2.1 of          ~
  ~ the License, or (at your option) any later version.                       ~
  ~                                                                           ~
  ~ This software is distributed in the hope that it will be useful,          ~
  ~ but WITHOUT ANY WARRANTY; without even the implied warranty of            ~
  ~ MERCHANTABILITY or FITNESS FOR A PARTICULAR PURPOSE. See the GNU          ~
  ~ Lesser General Public License for more details.                           ~
  ~                                                                           ~
  ~ You should have received a copy of the GNU Lesser General Public          ~
  ~ License along with this software; if not, write to the Free               ~
  ~ Software Foundation, Inc., 51 Franklin St, Fifth Floor, Boston, MA        ~
  ~ 02110-1301 USA, or see the FSF site: http://www.fsf.org.                  ~
  ~~~~~~~~~~~~~~~~~~~~~~~~~~~~~~~~~~~~~~~~~~~~~~~~~~~~~~~~~~~~~~~~~~~~~~~~~~~-->

<!DOCTYPE deployments PUBLIC
   "-//JBoss Portal//DTD Portal Object 2.6//EN"
   "http://www.jboss.org/portal/dtd/portal-object_2_6.dtd">
   
<deployments>
   <deployment>
      <parent-ref>default</parent-ref>
      <if-exists>keep</if-exists>
      <page>
         <page-name>Samples</page-name>
         <display-name xml:lang="en">Samples</display-name>
         <display-name xml:lang="fr">Exemples</display-name>
         <display-name xml:lang="it">Esempi</display-name>
         <display-name xml:lang="pt_BR">Exemplos</display-name>
         <display-name xml:lang="zh">样例</display-name>
<!--
         <properties>
            <property>
               <name>order</name>
               <value>3</value>
            </property>
         </properties>
-->
         <window>
            <window-name>RemoteControlPortletWindow</window-name>
            <instance-ref>RemoteControlPortletInstance</instance-ref>
            <region>left</region>
            <height>0</height>
         </window>
         <window>
            <window-name>ShoppingCartPortletWindow</window-name>
            <instance-ref>ShoppingCartPortletInstance</instance-ref>
            <region>left</region>
            <height>1</height>
         </window>

         <window>
            <window-name>GoogleMapPortletWindow</window-name>
            <instance-ref>GoogleMapPortletInstance</instance-ref>
            <region>center</region>
            <height>1</height>
         </window>

         <window>
            <window-name>GoogleWeatherPortletWindow1</window-name>
            <instance-ref>GoogleWeatherPortletInstance</instance-ref>
            <region>center</region>
            <height>2</height>
         </window>

         <window>
            <window-name>ShoppingCatalogPortletWindow</window-name>
            <instance-ref>ShoppingCatalogPortletInstance</instance-ref>
            <region>center</region>
            <height>5</height>
         </window>
      </page>
   </deployment>
</deployments>
